{
  "$schema": "http://json-schema.org/draft-07/schema#",
  "title": "UIN v0.8 (minimal)",
  "type": "object",
  "required": ["version", "canvas", "objects"],
  "properties": {
    "version": { "type": "string", "const": "0.8" },
    "canvas": { "type": "object" },
    "objects": { "type": "array" },
    "metadata": {
      "type": "object",
      "properties": {
        "title": { "type": "string" },
        "conformance": { "type": "string" }
      },
      "additionalProperties": false
    }
  },
  "additionalProperties": false
}
